{
  "_type": "https://in-toto.io/Statement/v1",
  "subject": [
    { "name": "findings.sarif",
      "digest": {
        "md5": "0cc175b9c0f1b6a831c399e269772661",
        "sha1": "745fa8588783413669f4ac6170d4645e39c15be4",
        "sha224": "d14a028c2a3a2bc9476102bb288234c415a2b01f828ea62ac5b3e42f",
        "sha256": "c3b4bb2d6093897483348925aaa73af03b3e3f4bd4ca38cef26dcb4212a2682e",
        "sha384": "38b060a751ac96384cd9327eb1b1e36a21fdb71114be07434c0cc7bf63f6e1da274edebfe76f65fbd51ad2f14898b95b",
        "sha512": "cf83e1357eefb8bdf1542850d66d8007d620e4050b5715dc83f4a921d36ce9ce47d0d13c5d85f2b0ff8318d2877eec2f63b931bd47417a81a538327af927da3e",
        "sha512_224": "d14a028c2a3a2bc9476102bb288234c415a2b01f828ea62ac5b3e42f",
        "sha512_256": "c3b4bb2d6093897483348925aaa73af03b3e3f4bd4ca38cef26dcb4212a2682e",
        "sha3_512": "cf83e1357eefb8bdf1542850d66d8007d620e4050b5715dc83f4a921d36ce9ce47d0d13c5d85f2b0ff8318d2877eec2f63b931bd47417a81a538327af927da3e",
        "dirHash": "2a1bb6127fb481c60f67692e22285fb306f3c6ffe62075e0ccf674d7c3adcb8f",
        "blake2b": "786a02f742015903c6c6fd852552d272912f4740e15847618a86e217f71f5419",
        "ripemd160": "9c1185a5c5e9fc54612808977ee8f548b2258d31",
        "paimlCustomAlgorithm": "not-hex-and-that-is-allowed-for-custom-algorithms"
      } }
  ],
  "predicateType": "https://paiml.dev/attestations/pr-review/v2",
  "predicate": {}
}
